format,name,description,mining_tool,sensitive_content,series_total,Attributes,collection
CHIP-0007,amaka-the-hypepriestess,Amaka is can never be intimidated no matter the circumstance. ,116,420,[object Object],[object Object],[object Object],[object Object],[object Object],[object Object],[object Object],[object Object],[object Object]
CHIP-0007,kemi-foodie,Kemi loves food and can also prepare good meals. ,117,420,[object Object],[object Object],[object Object],[object Object],[object Object],[object Object],[object Object],[object Object],[object Object]
CHIP-0007,ada-the-fashionister,Ada loves fashion that she rarely repeats cloths.,118,420,[object Object],[object Object],[object Object],[object Object],[object Object],[object Object],[object Object],[object Object],[object Object]
CHIP-0007,kayode-the-baller,Kayode loves life and lives it.,119,420,[object Object],[object Object],[object Object],[object Object],[object Object],[object Object],[object Object],[object Object],[object Object]
CHIP-0007,kola-of-lagos,Kola is the life of the party everywhere he is.,120,420,[object Object],[object Object],[object Object],[object Object],[object Object],[object Object],[object Object],[object Object],[object Object]
CHIP-0007,azikiwe-popular-trader,Azikiwe is a popular trader.,121,420,[object Object],[object Object],[object Object],[object Object],[object Object],[object Object],[object Object],[object Object],[object Object]
CHIP-0007,obasanjo-funny-guy,Obasanjo is such a sweet guy loves by all. ,122,420,[object Object],[object Object],[object Object],[object Object],[object Object],[object Object],[object Object],[object Object],[object Object]
CHIP-0007,yakubu-village-chief,Yakubu is the best village chieftain.,123,420,[object Object],[object Object],[object Object],[object Object],[object Object],[object Object],[object Object],[object Object],[object Object]
CHIP-0007,abacha-loves-smoking,Abacha loves taking cigarettes.,124,420,[object Object],[object Object],[object Object],[object Object],[object Object],[object Object],[object Object],[object Object],[object Object]
CHIP-0007,johnathan-good-leader,Johnathan is very progressive young man.,125,420,[object Object],[object Object],[object Object],[object Object],[object Object],[object Object],[object Object],[object Object],[object Object]
CHIP-0007,johnathan-genz-kid,Johnathan is zealous young man.,126,420,[object Object],[object Object],[object Object],[object Object],[object Object],[object Object],[object Object],[object Object],[object Object]
CHIP-0007,eddy-the-community,Eddy has so much positive energy.,127,420,[object Object],[object Object],[object Object],[object Object],[object Object],[object Object],[object Object],[object Object],[object Object]
CHIP-0007,olu-the-oba,Olu the great ruler in our land.,128,420,[object Object],[object Object],[object Object],[object Object],[object Object],[object Object],[object Object],[object Object],[object Object]
CHIP-0007,edu-the-biggest-trader,Edu is the biggest merchant in west coast.,129,420,[object Object],[object Object],[object Object],[object Object],[object Object],[object Object],[object Object],[object Object],[object Object]
CHIP-0007,james-importer-and-exporter,James is the sole importer and exporter of spare parts.,130,420,[object Object],[object Object],[object Object],[object Object],[object Object],[object Object],[object Object],[object Object],[object Object]
CHIP-0007,lanre-the-dreaded-guy,Lanre has a great reputation.,131,420,[object Object],[object Object],[object Object],[object Object],[object Object],[object Object],[object Object],[object Object],[object Object]
CHIP-0007,olamide-the-street-boy,Olamide has a sweet voice.,132,420,[object Object],[object Object],[object Object],[object Object],[object Object],[object Object],[object Object],[object Object],[object Object]
CHIP-0007,uche-peace-loving-man,Uche man of peace and discipline.,133,420,[object Object],[object Object],[object Object],[object Object],[object Object],[object Object],[object Object],[object Object],[object Object]
CHIP-0007,dave-the-tech-bro,Dave is a web3 enthusiast.,134,420,[object Object],[object Object],[object Object],[object Object],[object Object],[object Object],[object Object],[object Object],[object Object]
CHIP-0007,obi-the-biggest-humanitarian,Obi loves service to humanity.,135,420,[object Object],[object Object],[object Object],[object Object],[object Object],[object Object],[object Object],[object Object],[object Object]
CHIP-0007,precious-the-emotional-girl,Precious is soft hearted and sensitive.,136,420,[object Object],[object Object],[object Object],[object Object],[object Object],[object Object],[object Object],[object Object],[object Object]
CHIP-0007,ella-serious-minded,Ella a dedicated young lady.,137,420,[object Object],[object Object],[object Object],[object Object],[object Object],[object Object],[object Object],[object Object],[object Object]
CHIP-0007,cynthia-cute-eyes,Cynthia with priceless cute eyes.,138,420,[object Object],[object Object],[object Object],[object Object],[object Object],[object Object],[object Object],[object Object],[object Object]
CHIP-0007,mary-with-hair,Mary with her beautiful Afro.,139,420,[object Object],[object Object],[object Object],[object Object],[object Object],[object Object],[object Object],[object Object],[object Object]
CHIP-0007,ada-chewing-bubble-gum,Ada always chewing gum.,140,420,[object Object],[object Object],[object Object],[object Object],[object Object],[object Object],[object Object],[object Object],[object Object]
CHIP-0007,viganem-the-drummer-girl,She is known for typically playing the drum for 5 hours per day without a break.,141,420,[object Object],[object Object],[object Object],[object Object],[object Object],[object Object],[object Object],[object Object],[object Object]
CHIP-0007,lenusuka-the-big-woman,The lady that loves spending money and buying everybody asaobi.,142,420,[object Object],[object Object],[object Object],[object Object],[object Object],[object Object],[object Object],[object Object],[object Object]
CHIP-0007,enepua-the-clout-queen,The lady that travels all day and enjoys snapping food at restaurants.,143,420,[object Object],[object Object],[object Object],[object Object],[object Object],[object Object],[object Object],[object Object],[object Object]
CHIP-0007,usifong-queen-of-mushin,Changes her hair every 2 weeks and cannot finish one pure water.,144,420,[object Object],[object Object],[object Object],[object Object],[object Object],[object Object],[object Object],[object Object],[object Object]
CHIP-0007,akinyim-the-clown,The most interesting christmas clown, known for dancing in prisons and hospitals on christmas eve.,145,420,[object Object],[object Object],[object Object],[object Object],[object Object],[object Object],[object Object],[object Object],[object Object]
CHIP-0007,zawadi-mr-sleep-everywhere,Likes sleeping in the weirdest places especially in clubs.,146,420,[object Object],[object Object],[object Object],[object Object],[object Object],[object Object],[object Object],[object Object],[object Object]
CHIP-0007,chepkirui-mr-self-love,Likes taking care of himself and spending on himself.,147,420,[object Object],[object Object],[object Object],[object Object],[object Object],[object Object],[object Object],[object Object],[object Object]
CHIP-0007,naserian-the-fear-fear-dancer,A timid and dancer who is always afraid of a large crowd of audience and yet his dance moves can raise the dead.,148,420,[object Object],[object Object],[object Object],[object Object],[object Object],[object Object],[object Object],[object Object],[object Object]
CHIP-0007,wawuda-the-ashawo-of-africa,Brags about his body count and follows skirt anywhere.,149,420,[object Object],[object Object],[object Object],[object Object],[object Object],[object Object],[object Object],[object Object],[object Object]
CHIP-0007,kerubo-the-igbo-smoker,Loves only his igbo and is happy when he finds an old blunt.,150,420,[object Object],[object Object],[object Object],[object Object],[object Object],[object Object],[object Object],[object Object]
CHIP-0007,rehema-the-olodo,Failed primary 5 eight times and like playing football after school.,151,420,[object Object],[object Object],[object Object],[object Object],[object Object],[object Object],[object Object],[object Object],[object Object]
CHIP-0007,nekesa-the-brainbox,A proposed elite who cannot write a simple speech.,152,420,[object Object],[object Object],[object Object],[object Object],[object Object],[object Object],[object Object],[object Object],[object Object]
CHIP-0007,kiokoli-the-slowrunner,Always running in every race but never making it to the first 5.,153,420,[object Object],[object Object],[object Object],[object Object],[object Object],[object Object],[object Object],[object Object],[object Object]
CHIP-0007,adjuani-uncle-wire-wire,Mugu money spender that loves spending on women extravagantly.,154,420,[object Object],[object Object],[object Object],[object Object],[object Object],[object Object],[object Object],[object Object],[object Object]
CHIP-0007,ajobaru-a-creative-artist,A lovely artist who is known for creating magical art pieces that can spark a smile.,155,420,[object Object],[object Object],[object Object],[object Object],[object Object],[object Object],[object Object],[object Object],[object Object]
CHIP-0007,effiadem-the-fireman,A retired military general who always loves shooting at sight.,156,420,[object Object],[object Object],[object Object],[object Object],[object Object],[object Object],[object Object],[object Object],[object Object]
CHIP-0007,deladem-the-commandoo,The nerd who has watched all war movies but cannot fight a kid.,157,420,[object Object],[object Object],[object Object],[object Object],[object Object],[object Object],[object Object],[object Object],[object Object]
CHIP-0007,dogbeda-the-monger,A fisherman who pracitically live in the river.,158,420,[object Object],[object Object],[object Object],[object Object],[object Object],[object Object],[object Object],[object Object],[object Object]
CHIP-0007,enyonyam-our-slay-mama,Posts new pictures everyday and can snub for africa.,159,420,[object Object],[object Object],[object Object],[object Object],[object Object],[object Object],[object Object],[object Object],[object Object]
CHIP-0007,lumusi-pro-technician,The electrician well known for wiring burnt buildings.,160,420,[object Object],[object Object],[object Object],[object Object],[object Object],[object Object],[object Object],[object Object],[object Object]
CHIP-0007,funmi-the-fashionist,Funmi enjoys fashion and she always takes opportunity to showcase her wardrobe.,161,420,[object Object],[object Object],[object Object],[object Object],[object Object],[object Object],[object Object],[object Object],[object Object]
CHIP-0007,bola-the-funky,Bola is a funky fellow but she has another personality no one knows.,162,420,[object Object],[object Object],[object Object],[object Object],[object Object],[object Object],[object Object],[object Object],[object Object]
CHIP-0007,bimpe-the-runzgirl,Be careful with Bimpe because she cac be sensitive.,163,420,[object Object],[object Object],[object Object],[object Object],[object Object],[object Object],[object Object],[object Object],[object Object]
CHIP-0007,sola-the-queen,Sola is a princess as she's got the mind of a queen.,164,420,[object Object],[object Object],[object Object],[object Object],[object Object],[object Object],[object Object],[object Object],[object Object]
CHIP-0007,temi-afro-girl,Temi is know for her funny haircut and this time afro is up.,165,420,[object Object],[object Object],[object Object],[object Object],[object Object],[object Object],[object Object],[object Object],[object Object]
CHIP-0007,jonny-the-bravo,Jonny is friendly to all and everybody sees him as kind agile Jonny.,166,420,[object Object],[object Object],[object Object],[object Object],[object Object],[object Object],[object Object],[object Object],[object Object]
CHIP-0007,tunde-the-bigman,Tunde is the big man on the street and flamboyant life style is his identity.,167,420,[object Object],[object Object],[object Object],[object Object],[object Object],[object Object],[object Object],[object Object],[object Object]
CHIP-0007,joe-the-plain,Plain and simple and no one in town is more gentle that broda Joe.,168,420,[object Object],[object Object],[object Object],[object Object],[object Object],[object Object],[object Object],[object Object],[object Object]
CHIP-0007,wale-sharp-guy,Wale no de carry last because he thinks and act fast.,169,420,[object Object],[object Object],[object Object],[object Object],[object Object],[object Object],[object Object],[object Object],[object Object]
CHIP-0007,dele-the-snoozer,If sleeping were to be a job then Dele will be the world busiest man.,170,420,[object Object],[object Object],[object Object],[object Object],[object Object],[object Object],[object Object],[object Object],[object Object]
CHIP-0007,father-of-tolu,Baba Tolu is a proud father. He will sell his soul just to see Tolu excel in life.,171,420,[object Object],[object Object],[object Object],[object Object],[object Object],[object Object],[object Object],[object Object],[object Object]
CHIP-0007,emeka-the-chief,Chief Emeka is the pillar of the community. Just and fair to all. The real mazi.,172,420,[object Object],[object Object],[object Object],[object Object],[object Object],[object Object],[object Object],[object Object],[object Object]
CHIP-0007,lawal-the-drooler,Lawal has only one business which is just to sleep and sleep. it's only normal for him to drool anytime.,173,420,[object Object],[object Object],[object Object],[object Object],[object Object],[object Object],[object Object],[object Object],[object Object]
CHIP-0007,solo-the-messenger,Solo is a multitasker if you need anything done in your home, Solo is your guy.,174,420,[object Object],[object Object],[object Object],[object Object],[object Object],[object Object],[object Object],[object Object],[object Object]
CHIP-0007,femi-the-honorable,Honorable Femi is the modern day politician but everything he does is only to further his political career.,175,420,[object Object],[object Object],[object Object],[object Object],[object Object],[object Object],[object Object],[object Object],[object Object],[object Object]
CHIP-0007,friday-the-bigsboy,Friday always live up to his name. Every Friday is for the party.,176,420,[object Object],[object Object],[object Object],[object Object],[object Object],[object Object],[object Object],[object Object],[object Object],[object Object]
CHIP-0007,kweku-the-planter,Kweku says he did it but he dey plant until he was bursted.,177,420,[object Object],[object Object],[object Object],[object Object],[object Object],[object Object],[object Object],[object Object],[object Object]
CHIP-0007,2pac-the-remix,2pac is alive in him because his style is exactly the same.,178,420,[object Object],[object Object],[object Object],[object Object],[object Object],[object Object],[object Object],[object Object],[object Object]
CHIP-0007,tope-the-influencer,Tope is a famous influencer and she is loved by his followers which keep growing everyday.,179,420,[object Object],[object Object],[object Object],[object Object],[object Object],[object Object],[object Object],[object Object],[object Object]
CHIP-0007,gabby-the-evangelist,Evangelist Gabby is blending gospel with comedy.,180,420,[object Object],[object Object],[object Object],[object Object],[object Object],[object Object],[object Object],[object Object],[object Object]
CHIP-0007,beauty-of-town,She is the most beautiful in the neighbourhood.,181,420,[object Object],[object Object],[object Object],[object Object],[object Object],[object Object],[object Object],[object Object]
CHIP-0007,lola-babe,You will always see her in tight fittted dresses; she loves the exquisite life.,182,420,[object Object],[object Object],[object Object],[object Object],[object Object],[object Object],[object Object],[object Object],[object Object]
CHIP-0007,cardy-h-sharp-babe,Cardy is the sharpest amongst her friends.,183,420,[object Object],[object Object],[object Object],[object Object],[object Object],[object Object],[object Object],[object Object],[object Object]
CHIP-0007,bella-the-baller,Bella earns big; she is always out partying and buying bottles.,184,420,[object Object],[object Object],[object Object],[object Object],[object Object],[object Object],[object Object],[object Object],[object Object]
CHIP-0007,milly-of-roses,She is very attractive but doesn't have a social life.,185,420,[object Object],[object Object],[object Object],[object Object],[object Object],[object Object],[object Object],[object Object],[object Object]
CHIP-0007,preciousjada-the-viper,Her opinions are great but her words sting like viper.,186,420,[object Object],[object Object],[object Object],[object Object],[object Object],[object Object],[object Object],[object Object]
CHIP-0007,lolly-of-ny,Most popular visual artist; alway gets praised for her creativity.,187,420,[object Object],[object Object],[object Object],[object Object],[object Object],[object Object],[object Object],[object Object],[object Object]
CHIP-0007,disy-the-dancer,A dancer that brings the spotlight on her.,188,420,[object Object],[object Object],[object Object],[object Object],[object Object],[object Object],[object Object],[object Object],[object Object]
CHIP-0007,jenny-the-great,Loves burna boy; you will always catch him on his tracks.,189,420,[object Object],[object Object],[object Object],[object Object],[object Object],[object Object],[object Object],[object Object],[object Object]
CHIP-0007,lolly-the-pop,Everywhere she goes she shines like a star.,190,420,[object Object],[object Object],[object Object],[object Object],[object Object],[object Object],[object Object],[object Object],[object Object]
CHIP-0007,disy-the-queen,An introvert that loves her own space.,191,420,[object Object],[object Object],[object Object],[object Object],[object Object],[object Object],[object Object],[object Object],[object Object]
CHIP-0007,jennyp-of-lagos,She knows all the celebrities in lagos but she stays lowkey.,192,420,[object Object],[object Object],[object Object],[object Object],[object Object],[object Object],[object Object],[object Object],[object Object]
CHIP-0007,jada-of-life,She started a night club in lekki and now she is a millionaire.,193,420,[object Object],[object Object],[object Object],[object Object],[object Object],[object Object],[object Object],[object Object],[object Object]
CHIP-0007,sandy-the-rapper,She just loves to rap and Quavo is her super star.,194,420,[object Object],[object Object],[object Object],[object Object],[object Object],[object Object],[object Object],[object Object],[object Object]
CHIP-0007,dahila-the-genius,The genius in the family; she always wins awards.,195,420,[object Object],[object Object],[object Object],[object Object],[object Object],[object Object],[object Object],[object Object],[object Object]
CHIP-0007,rosemary-of-yaba,She is always travellling to cotonou to buy clothes for her store.,196,420,[object Object],[object Object],[object Object],[object Object],[object Object],[object Object],[object Object],[object Object],[object Object]
CHIP-0007,jennifer-of-island,She loves travelling; she is in maldives this year.,197,420,[object Object],[object Object],[object Object],[object Object],[object Object],[object Object],[object Object],[object Object],[object Object]
CHIP-0007,opeyemi-of-lekki,She is a lekki socialite; braids her hairfor 85k.,198,420,[object Object],[object Object],[object Object],[object Object],[object Object],[object Object],[object Object],[object Object],[object Object]
CHIP-0007,vicky-the-artist,An artist; she brings drawings to life.,199,420,[object Object],[object Object],[object Object],[object Object],[object Object],[object Object],[object Object],[object Object],[object Object]
CHIP-0007,afrogirl-sailor,She loves water and sails the ocean yearly.,200,420,[object Object],[object Object],[object Object],[object Object],[object Object],[object Object],[object Object],[object Object],[object Object]
CHIP-0007,ahmed-the-merchant,A rich merchant that sells in babylon.,201,420,[object Object],[object Object],[object Object],[object Object],[object Object],[object Object],[object Object],[object Object],[object Object]
CHIP-0007,blind-tonia,A girl that lost one of her eyes in a street fight.,202,420,[object Object],[object Object],[object Object],[object Object],[object Object],[object Object],[object Object],[object Object],[object Object]
CHIP-0007,buffy-the-vampire,A vampire diary protagonist that got bitten by a vampire in real life.,203,420,[object Object],[object Object],[object Object],[object Object],[object Object],[object Object],[object Object],[object Object],[object Object]
CHIP-0007,caro-lipstick,A girl that puts on lipstick always, even to bed.,204,420,[object Object],[object Object],[object Object],[object Object],[object Object],[object Object],[object Object],[object Object],[object Object]
CHIP-0007,charity-the-maid,A maid that works for the fun of it.,205,420,[object Object],[object Object],[object Object],[object Object],[object Object],[object Object],[object Object],[object Object],[object Object]
CHIP-0007,charity-with-fakehair,A girl with a bald hair but always wears wig to cover her head.,206,420,[object Object],[object Object],[object Object],[object Object],[object Object],[object Object],[object Object],[object Object],[object Object]
CHIP-0007,daniel-the-hustler,A boy that lives in the streets of Lagos hustling everyday to make ends meet.,207,420,[object Object],[object Object],[object Object],[object Object],[object Object],[object Object],[object Object],[object Object],[object Object]
CHIP-0007,grandma-nanny,A grandmother that does nothing but sleeps all day.,208,420,[object Object],[object Object],[object Object],[object Object],[object Object],[object Object],[object Object],[object Object],[object Object]
CHIP-0007,granpa-willy,A grandfather that drinks beer and reads newspaper all day.,209,420,[object Object],[object Object],[object Object],[object Object],[object Object],[object Object],[object Object],[object Object],[object Object]
CHIP-0007,joshua-gang-leader,A boy born to ritualist parents and now runs his own gang.,210,420,[object Object],[object Object],[object Object],[object Object],[object Object],[object Object],[object Object],[object Object],[object Object]
CHIP-0007,karashika-queen,A woman of the underworld that influences rich men into giving up their money.,211,420,[object Object],[object Object],[object Object],[object Object],[object Object],[object Object],[object Object],[object Object],[object Object]
CHIP-0007,king-of-baldmen,A man that was born bald and has never seen a hair on his head.,212,420,[object Object],[object Object],[object Object],[object Object],[object Object],[object Object],[object Object],[object Object],[object Object]
CHIP-0007,musa-masked-mouth,Musa uses a tape to cover his mouth to prevent him from talking too much.,213,420,[object Object],[object Object],[object Object],[object Object],[object Object],[object Object],[object Object],[object Object],[object Object]
CHIP-0007,queen-of-smokers,A chronic smoker looking for a spouse that will join her to die of smoking.,214,420,[object Object],[object Object],[object Object],[object Object],[object Object],[object Object],[object Object],[object Object],[object Object]
CHIP-0007,redlips-man,A man that kissed a woman and got his lips burnt.,215,420,[object Object],[object Object],[object Object],[object Object],[object Object],[object Object],[object Object],[object Object],[object Object]
CHIP-0007,sleevless-maid,A girl that nevers wears long cloths and gets herself thrown out of churches for indecent dressing.,216,420,[object Object],[object Object],[object Object],[object Object],[object Object],[object Object],[object Object],[object Object],[object Object]
CHIP-0007,stephen-bluecap,Stephen always wears blue cap even to the church.,217,420,[object Object],[object Object],[object Object],[object Object],[object Object],[object Object],[object Object],[object Object],[object Object]
CHIP-0007,tinubu-gateman,Tinubu has been a gateman all his life.,218,420,[object Object],[object Object],[object Object],[object Object],[object Object],[object Object],[object Object],[object Object],[object Object]
CHIP-0007,vampire-girl,She dresses up as a vampire every haloween.,219,420,[object Object],[object Object],[object Object],[object Object],[object Object],[object Object],[object Object],[object Object],[object Object]
CHIP-0007,yusuf-the-smoker,A chronic smoker with damaged lungs.,220,420,[object Object],[object Object],[object Object],[object Object],[object Object],[object Object],[object Object],[object Object],[object Object]
CHIP-0007,lola-hng-newbie,A confused hng participant that cannot understand her project.,221,420,[object Object],[object Object],[object Object],[object Object],[object Object],[object Object],[object Object],[object Object],[object Object]
CHIP-0007,nene-caroline,A housewife that loves taking care of her family.,222,420,[object Object],[object Object],[object Object],[object Object],[object Object],[object Object],[object Object],[object Object],[object Object]
CHIP-0007,wazo-partystopper,A Nigerian aunty that loves to attend owambe parties.,223,420,[object Object],[object Object],[object Object],[object Object],[object Object],[object Object],[object Object],[object Object],[object Object]
CHIP-0007,melanin-janet,A young lady with a soft personality.,224,420,[object Object],[object Object],[object Object],[object Object],[object Object],[object Object],[object Object],[object Object],[object Object]
