format,name,description,mining_tool,sensitive_content,series_total,Attributes,collection
CHIP-0007,leo-sugarmummy,A middle age wild yankee returnee.,225,420,[object Object],[object Object],[object Object],[object Object],[object Object],[object Object],[object Object],[object Object],[object Object]
CHIP-0007,novice-joane,A princess worried about finding true love.,226,420,[object Object],[object Object],[object Object],[object Object],[object Object],[object Object],[object Object],[object Object],[object Object]
CHIP-0007,goofy-simbi,An eccentric teenager that loves music.,227,420,[object Object],[object Object],[object Object],[object Object],[object Object],[object Object],[object Object],[object Object],[object Object]
CHIP-0007,akwaaba-ghana,A depressed gothic introvert.,228,420,[object Object],[object Object],[object Object],[object Object],[object Object],[object Object],[object Object],[object Object],[object Object]
CHIP-0007,aunty-toyin,An oversabi family member.,229,420,[object Object],[object Object],[object Object],[object Object],[object Object],[object Object],[object Object],[object Object],[object Object]
CHIP-0007,pretty-hauwa,A young bride involved in an early marriage.,230,420,[object Object],[object Object],[object Object],[object Object],[object Object],[object Object],[object Object],[object Object],[object Object]
CHIP-0007,chimamanda-enugu,A young lady born during the war.,231,420,[object Object],[object Object],[object Object],[object Object],[object Object],[object Object],[object Object],[object Object],[object Object]
CHIP-0007,kente-solape,A respectful and diligent princess.,232,420,[object Object],[object Object],[object Object],[object Object],[object Object],[object Object],[object Object],[object Object],[object Object]
CHIP-0007,vamp-karishika,Queen of the royal Ghana youths,233,420,[object Object],[object Object],[object Object],[object Object],[object Object],[object Object],[object Object],[object Object],[object Object]
CHIP-0007,genz-monique,A sassy lady with her own vibe.,234,420,[object Object],[object Object],[object Object],[object Object],[object Object],[object Object],[object Object],[object Object],[object Object]
CHIP-0007,femi-boltz,A driver hustling his way through life.,235,420,[object Object],[object Object],[object Object],[object Object],[object Object],[object Object],[object Object],[object Object],[object Object]
CHIP-0007,agba-tech,A tech bro that loves to party but has bad communication skill.,236,420,[object Object],[object Object],[object Object],[object Object],[object Object],[object Object],[object Object],[object Object],[object Object]
CHIP-0007,brian-richkid,A trust fund baby that does not know how to manage money.,237,420,[object Object],[object Object],[object Object],[object Object],[object Object],[object Object],[object Object],[object Object],[object Object]
CHIP-0007,nandi-zulu,A fierce African Queen.,238,420,[object Object],[object Object],[object Object],[object Object],[object Object],[object Object],[object Object],[object Object],[object Object]
CHIP-0007,ade-demon,A Lekki playboy that makes money from crypto.,239,420,[object Object],[object Object],[object Object],[object Object],[object Object],[object Object],[object Object],[object Object],[object Object]
CHIP-0007,karim-rapper,A young and proud Lagos rapper.,240,420,[object Object],[object Object],[object Object],[object Object],[object Object],[object Object],[object Object],[object Object],[object Object]
CHIP-0007,bobo-alinco,Alinco always in the mood for play.,241,420,[object Object],[object Object],[object Object],[object Object],[object Object],[object Object],[object Object],[object Object],[object Object]
CHIP-0007,chi-lastborn,Baby of the house; the lastborn of an average Nigerian family.,242,420,[object Object],[object Object],[object Object],[object Object],[object Object],[object Object],[object Object],[object Object],[object Object]
CHIP-0007,uju-robo-robo,An aso-oke business woman at Balogun market.,243,420,[object Object],[object Object],[object Object],[object Object],[object Object],[object Object],[object Object],[object Object],[object Object]
CHIP-0007,yetunde-anifowose,Old money lady who was in UK before UK was UK.,244,420,[object Object],[object Object],[object Object],[object Object],[object Object],[object Object],[object Object],[object Object],[object Object]
CHIP-0007,dumebi-jjc,Newly admitted to the university; looking for freedom from her parents.,245,420,[object Object],[object Object],[object Object],[object Object],[object Object],[object Object],[object Object],[object Object],[object Object]
CHIP-0007,ukwu-nengi,Well endowed woman who will always make heads turn.,246,420,[object Object],[object Object],[object Object],[object Object],[object Object],[object Object],[object Object],[object Object],[object Object]
CHIP-0007,nonso-malay,Nonso Malay is an enterprising man who made his fortune after he travelled abroad.,247,420,[object Object],[object Object],[object Object],[object Object],[object Object],[object Object],[object Object],[object Object],[object Object]
CHIP-0007,saro-texaco,An oil tycoon who dominates.,248,420,[object Object],[object Object],[object Object],[object Object],[object Object],[object Object],[object Object],[object Object],[object Object]
CHIP-0007,akpos-agbero,A Warri boy always in the mood for violence.,249,420,[object Object],[object Object],[object Object],[object Object],[object Object],[object Object],[object Object],[object Object],[object Object]
CHIP-0007,kasali-danfo,A danfo driver popular for his positive outlook of life.,250,420,[object Object],[object Object],[object Object],[object Object],[object Object],[object Object],[object Object],[object Object],[object Object]
CHIP-0007,osaz-benz,Osaz benz is an Edo born car dealer who buys only Mercedes Benz cars for his clients.,251,420,[object Object],[object Object],[object Object],[object Object],[object Object],[object Object],[object Object],[object Object],[object Object]
CHIP-0007,kareem-kasanova,Abuja big boy; he has sweet mouth for wooing ladies.,252,420,[object Object],[object Object],[object Object],[object Object],[object Object],[object Object],[object Object],[object Object],[object Object]
CHIP-0007,mayor-of-uyo,Essien is a top Lagos businessman who hails from Uyo.,253,420,[object Object],[object Object],[object Object],[object Object],[object Object],[object Object],[object Object],[object Object],[object Object]
CHIP-0007,chinedu-china,An Nnewi blooded spareparts importer and exporter with goods from china.,254,420,[object Object],[object Object],[object Object],[object Object],[object Object],[object Object],[object Object],[object Object],[object Object]
CHIP-0007,papa-ekene,The oldest man of the Akwauzu clan.,255,420,[object Object],[object Object],[object Object],[object Object],[object Object],[object Object],[object Object],[object Object],[object Object]
CHIP-0007,ogbeni-rauf,Minister of enjoyment for Freedom state.,256,420,[object Object],[object Object],[object Object],[object Object],[object Object],[object Object],[object Object],[object Object],[object Object]
CHIP-0007,koffi-banku,He loves food so much and doesnt joke with his meal time.,257,420,[object Object],[object Object],[object Object],[object Object],[object Object],[object Object],[object Object],[object Object],[object Object]
CHIP-0007,alhaji-bello,Rich Hausa business mongul controlling half of cow production in Nigeria.,258,420,[object Object],[object Object],[object Object],[object Object],[object Object],[object Object],[object Object],[object Object],[object Object]
CHIP-0007,toju-mafejopami,Toju is a street hustler does not like stress.,259,420,[object Object],[object Object],[object Object],[object Object],[object Object],[object Object],[object Object],[object Object],[object Object]
CHIP-0007,femi-maserati,Rich kid who resides in lekki; known by everybody because he drives a maserati.,260,420,[object Object],[object Object],[object Object],[object Object],[object Object],[object Object],[object Object],[object Object],[object Object]
CHIP-0007,paul-the-comedian,Paul is a funny man; he always makes great jokes at parties.,261,420,[object Object],[object Object],[object Object],[object Object],[object Object],[object Object],[object Object],[object Object]
CHIP-0007,amina-lagos-housewife,Amina is always showing the rich housewife vibes.,262,420,[object Object],[object Object],[object Object],[object Object],[object Object],[object Object],[object Object],[object Object],[object Object]
CHIP-0007,kiekie-the-asoebibella,Kiekie is classfied as the life of the party.,263,420,[object Object],[object Object],[object Object],[object Object],[object Object],[object Object],[object Object],[object Object],[object Object]
CHIP-0007,kunle-the-hunter,Kunle goes for the best and hits all his targets at bull's eye.,264,420,[object Object],[object Object],[object Object],[object Object],[object Object],[object Object],[object Object],[object Object],[object Object]
CHIP-0007,amara-the-hairstylist,Amara is truly your one stop shop for all your hair & beauty needs.,265,420,[object Object],[object Object],[object Object],[object Object],[object Object],[object Object],[object Object],[object Object],[object Object]
CHIP-0007,mary-nail-technician,Mary makes magic with her press-on nails.,266,420,[object Object],[object Object],[object Object],[object Object],[object Object],[object Object],[object Object],[object Object],[object Object]
CHIP-0007,odogwu-oil-contractor,From malaysia to kaduna, odogwu's oil is known.,267,420,[object Object],[object Object],[object Object],[object Object],[object Object],[object Object],[object Object],[object Object],[object Object]
CHIP-0007,simisola-the-kenteprincess,Simisola rocks kente even in swim outfits.,268,420,[object Object],[object Object],[object Object],[object Object],[object Object],[object Object],[object Object],[object Object],[object Object]
CHIP-0007,mariam-beauty-queen,Beauty is a fairy tale where mariam appears.,269,420,[object Object],[object Object],[object Object],[object Object],[object Object],[object Object],[object Object],[object Object],[object Object]
CHIP-0007,obinna-the-musician,Obinna might never be an a-list artist.,270,420,[object Object],[object Object],[object Object],[object Object],[object Object],[object Object],[object Object],[object Object],[object Object]
CHIP-0007,sandra-the-shybaby,Sandra is a shy woman even at parties.,271,420,[object Object],[object Object],[object Object],[object Object],[object Object],[object Object],[object Object],[object Object],[object Object]
CHIP-0007,chiamaka-the-dancer,Chiamaka dances so well and earned the guinness world record.,272,420,[object Object],[object Object],[object Object],[object Object],[object Object],[object Object],[object Object],[object Object],[object Object]
CHIP-0007,mensah-fashion-icon,Mensah outfits are always giving us christopher hemsworth vibes.,273,420,[object Object],[object Object],[object Object],[object Object],[object Object],[object Object],[object Object],[object Object],[object Object]
CHIP-0007,lucy-the-fumigator,Lucy is nicknamed the pest exterminator.,274,420,[object Object],[object Object],[object Object],[object Object],[object Object],[object Object],[object Object],[object Object],[object Object]
CHIP-0007,nneka-wedding-planner,Nneka plans the best weddings with great details.,275,420,[object Object],[object Object],[object Object],[object Object],[object Object],[object Object],[object Object],[object Object],[object Object]
CHIP-0007,shakira-the-gangster,Shakira is the most feared criminal.,276,420,[object Object],[object Object],[object Object],[object Object],[object Object],[object Object],[object Object],[object Object],[object Object]
CHIP-0007,lola-afropopping-princess,Lola loves to lick lollipops like; she is everyones afropop queen.,277,420,[object Object],[object Object],[object Object],[object Object],[object Object],[object Object],[object Object],[object Object],[object Object]
CHIP-0007,sharon-walking-dead,sharon cannot work under pressure; she is a soft babe.,278,420,[object Object],[object Object],[object Object],[object Object],[object Object],[object Object],[object Object],[object Object],[object Object]
CHIP-0007,olivia-great-teacher,Students enjoys olivia's classes.,279,420,[object Object],[object Object],[object Object],[object Object],[object Object],[object Object],[object Object],[object Object],[object Object]
CHIP-0007,nicole-sleep-warrior,Nicole holds the sleep award in our community, she wouldn't wake up at the sound of a detonated nuclear bomb.,280,420,[object Object],[object Object],[object Object],[object Object],[object Object],[object Object],[object Object],[object Object],[object Object]
CHIP-0007,busola-the-shakara,She is a fashion icon that loves luxurious items.,281,420,[object Object],[object Object],[object Object],[object Object],[object Object],[object Object],[object Object],[object Object],[object Object]
CHIP-0007,bella-the-artist,A lady that host a fashion week show,282,420,[object Object],[object Object],[object Object],[object Object],[object Object],[object Object],[object Object],[object Object],[object Object]
CHIP-0007,queen-the-extrovert,A woman who enjoys being high all the time,283,420,[object Object],[object Object],[object Object],[object Object],[object Object],[object Object],[object Object],[object Object],[object Object]
CHIP-0007,mary-toxic-lady,A lady who is toxic around people,284,420,[object Object],[object Object],[object Object],[object Object],[object Object],[object Object],[object Object],[object Object],[object Object]
CHIP-0007,elizabeth-the-richkid,A university undergraduate from a rich background,285,420,[object Object],[object Object],[object Object],[object Object],[object Object],[object Object],[object Object],[object Object],[object Object]
CHIP-0007,larry-the-westerner,A Yoruba Man who smokes his pipe in peace,286,420,[object Object],[object Object],[object Object],[object Object],[object Object],[object Object],[object Object],[object Object],[object Object]
CHIP-0007,danjuma-the-shocked,A pensioneer who got told his bank is on distress,287,420,[object Object],[object Object],[object Object],[object Object],[object Object],[object Object],[object Object],[object Object],[object Object]
CHIP-0007,yomi-the-fashionista,Winner of the Lagos GT Bank fashion week.,288,420,[object Object],[object Object],[object Object],[object Object],[object Object],[object Object],[object Object],[object Object],[object Object]
CHIP-0007,ibu-the-importer,A rich man who steps on people's toes,289,420,[object Object],[object Object],[object Object],[object Object],[object Object],[object Object],[object Object],[object Object],[object Object]
CHIP-0007,massa-the-ghanian,A rich trader who loves giving back to the community,290,420,[object Object],[object Object],[object Object],[object Object],[object Object],[object Object],[object Object],[object Object],[object Object]
CHIP-0007,james-the-musician,A Nigerian based musician who host shows,291,420,[object Object],[object Object],[object Object],[object Object],[object Object],[object Object],[object Object],[object Object],[object Object]
CHIP-0007,gbenga-titled-man,A chief who is very ambitious in his pursuits for fame,292,420,[object Object],[object Object],[object Object],[object Object],[object Object],[object Object],[object Object],[object Object],[object Object]
CHIP-0007,abaga-the-rapper,A flashy millionaire and a music rapper,293,420,[object Object],[object Object],[object Object],[object Object],[object Object],[object Object],[object Object],[object Object],[object Object]
CHIP-0007,izuchukwu-the-fisherman,A fisherman who knows how to paddle well,294,420,[object Object],[object Object],[object Object],[object Object],[object Object],[object Object],[object Object],[object Object],[object Object]
CHIP-0007,mark-the-philanthropist,A London based philantropist.,295,420,[object Object],[object Object],[object Object],[object Object],[object Object],[object Object],[object Object],[object Object],[object Object]
CHIP-0007,desmond-the-politician,A young politician who just became a minister,296,420,[object Object],[object Object],[object Object],[object Object],[object Object],[object Object],[object Object],[object Object],[object Object]
CHIP-0007,okoro-the-bachelor,A local palm wine tapper with hopes and dreams,297,420,[object Object],[object Object],[object Object],[object Object],[object Object],[object Object],[object Object],[object Object],[object Object]
CHIP-0007,saro-the-clothemaker,The yoruba man that stole the king's wife.,298,420,[object Object],[object Object],[object Object],[object Object],[object Object],[object Object],[object Object],[object Object],[object Object]
CHIP-0007,kalu-the-ichie,A man of wealth with afluence spreading all over the east,299,420,[object Object],[object Object],[object Object],[object Object],[object Object],[object Object],[object Object],[object Object],[object Object]
CHIP-0007,tamuno-the-prince,An Ijaw prince who is also the heir to the throne,300,420,[object Object],[object Object],[object Object],[object Object],[object Object],[object Object],[object Object],[object Object],[object Object]
CHIP-0007,wendy-the-banker,Wendy loves working in the bank, as she gets to meet different people.,301,420,[object Object],[object Object],[object Object],[object Object],[object Object],[object Object],[object Object],[object Object],[object Object]
CHIP-0007,uduak-the-darkhorse,Uduak looks innocent and has the whole apartment bugged,302,420,[object Object],[object Object],[object Object],[object Object],[object Object],[object Object],[object Object],[object Object],[object Object]
CHIP-0007,timeyin-the-eccentic,Timeyin is as eccentric as they come with no care for others opinions,303,420,[object Object],[object Object],[object Object],[object Object],[object Object],[object Object],[object Object],[object Object],[object Object]
CHIP-0007,omawunmi-the-businesswoman,Omawunmi is a no-nonsense woman with a shop in idumota,304,420,[object Object],[object Object],[object Object],[object Object],[object Object],[object Object],[object Object],[object Object],[object Object]
CHIP-0007,halima-the-housewife,Halima loves to bake and cook for her children,305,420,[object Object],[object Object],[object Object],[object Object],[object Object],[object Object],[object Object],[object Object],[object Object]
CHIP-0007,muna-the-blocksister,Muna loves to tell everyone in the block about her younger escapades,306,420,[object Object],[object Object],[object Object],[object Object],[object Object],[object Object],[object Object],[object Object],[object Object]
CHIP-0007,stella-the-gossip,Nobody gossips on the block like stella when smoking.,307,420,[object Object],[object Object],[object Object],[object Object],[object Object],[object Object],[object Object],[object Object],[object Object]
CHIP-0007,agbani-the-wannabe,Agbani loves to shop antique decorations for her mansion in Idi-Iroko.,308,420,[object Object],[object Object],[object Object],[object Object],[object Object],[object Object],[object Object],[object Object],[object Object]
CHIP-0007,asante-the-warrior,Asante came from a long line of warriors in Ghana.,309,420,[object Object],[object Object],[object Object],[object Object],[object Object],[object Object],[object Object],[object Object],[object Object]
CHIP-0007,hilda-the-insomaniac,Hilda prefers to sleep during the day.,310,420,[object Object],[object Object],[object Object],[object Object],[object Object],[object Object],[object Object],[object Object],[object Object]
CHIP-0007,sisiyemi-the-streetaunty,Sisi Yemi is everyone's favourite street aunty.,311,420,[object Object],[object Object],[object Object],[object Object],[object Object],[object Object],[object Object],[object Object],[object Object]
CHIP-0007,chiamaka-the-bully,Chiamaka hates people in her business and likes to scare the kids on the block.,312,420,[object Object],[object Object],[object Object],[object Object],[object Object],[object Object],[object Object],[object Object],[object Object]
CHIP-0007,gift-the-fashionista,Gift has always been bold and that spreads to her fashion sense too.,313,420,[object Object],[object Object],[object Object],[object Object],[object Object],[object Object],[object Object],[object Object],[object Object]
CHIP-0007,omoyene-the-weirdo,Omoyene likes to murmur to herself and talks about seeing ghosts.,314,420,[object Object],[object Object],[object Object],[object Object],[object Object],[object Object],[object Object],[object Object],[object Object]
CHIP-0007,maria-the-freshface,Maria likes to believe the world is sunshine and rainbows while blowing gum.,315,420,[object Object],[object Object],[object Object],[object Object],[object Object],[object Object],[object Object],[object Object],[object Object]
CHIP-0007,monica-the-smoker,Monica is never found without a pipe and loves to interject in every conversation.,316,420,[object Object],[object Object],[object Object],[object Object],[object Object],[object Object],[object Object],[object Object],[object Object]
CHIP-0007,janet-is-always-found-singing ,Janet is always found singing in whatever activity shes doing.,317,420,[object Object],[object Object],[object Object],[object Object],[object Object],[object Object],[object Object],[object Object],[object Object]
CHIP-0007,emi-the-reggae-girl,EMi is a beautiful dancer; she rules the reggae world.,318,420,[object Object],[object Object],[object Object],[object Object],[object Object],[object Object],[object Object],[object Object],[object Object]
CHIP-0007,aisha-love-the-life-of-the-party,Aisha always party during the weekend.,319,420,[object Object],[object Object],[object Object],[object Object],[object Object],[object Object],[object Object],[object Object],[object Object]
CHIP-0007,amaka-the-tailor,She sews the most beautiful dress in the hood.,320,420,[object Object],[object Object],[object Object],[object Object],[object Object],[object Object],[object Object],[object Object],[object Object]
CHIP-0007,omunyinyi-the-stoic,Omunyinyi wears a Kitenge coat.,321,420,[object Object],[object Object],[object Object],[object Object],[object Object],[object Object],[object Object],[object Object],[object Object]
CHIP-0007,kamau-the-sleeper,Kamau has his eyes closed as he meditates.,322,420,[object Object],[object Object],[object Object],[object Object],[object Object],[object Object],[object Object],[object Object],[object Object]
CHIP-0007,mutiso-the-lastborn,Mutiso is masked up but dozes off while waiting for food. ,323,420,[object Object],[object Object],[object Object],[object Object],[object Object],[object Object],[object Object],[object Object],[object Object]
CHIP-0007,omondi-the-vegeterian,Omondi wears a green coat with lots of patterns. ,324,420,[object Object],[object Object],[object Object],[object Object],[object Object],[object Object],[object Object],[object Object],[object Object]
CHIP-0007,barasa-the-optimist,Barasa looks up to the sky and makes a wish.,325,420,[object Object],[object Object],[object Object],[object Object],[object Object],[object Object],[object Object],[object Object],[object Object]
CHIP-0007,mwembu-the-elder,Mwembu is old but not so old and yellow is his favorite color.,326,420,[object Object],[object Object],[object Object],[object Object],[object Object],[object Object],[object Object],[object Object],[object Object]
CHIP-0007,mbogi-the-fighter,Mbogi is captured and forced to wear a mask. ,327,420,[object Object],[object Object],[object Object],[object Object],[object Object],[object Object],[object Object],[object Object],[object Object]
CHIP-0007,mrosho-the-runner,Mrosho has his mask on and yet still runs his race. ,328,420,[object Object],[object Object],[object Object],[object Object],[object Object],[object Object],[object Object],[object Object],[object Object]
CHIP-0007,milele-the-african,Milele wears a dress with a nice african print in orange.,329,420,[object Object],[object Object],[object Object],[object Object],[object Object],[object Object],[object Object],[object Object],[object Object]
CHIP-0007,olebon-the-oloibon,Olebon is in a customized buba sokoto.,330,420,[object Object],[object Object],[object Object],[object Object],[object Object],[object Object],[object Object],[object Object],[object Object]
CHIP-0007,chifu-the-maasai,Maasai shuka keeps bringing inspiration for new clothings. ,331,420,[object Object],[object Object],[object Object],[object Object],[object Object],[object Object],[object Object],[object Object],[object Object]
CHIP-0007,mwangaa-the-voice,Mwangaa the chief is controlling but still loved as he has a calming voice.,332,420,[object Object],[object Object],[object Object],[object Object],[object Object],[object Object],[object Object],[object Object],[object Object]
CHIP-0007,waforte-the-first,Waforte loves to sleep and does nothing else.,333,420,[object Object],[object Object],[object Object],[object Object],[object Object],[object Object],[object Object],[object Object],[object Object]
CHIP-0007,kariuki-the-prayerful-one,Kariuki closes his eyes as he watches the sunset.,334,420,[object Object],[object Object],[object Object],[object Object],[object Object],[object Object],[object Object],[object Object],[object Object]
CHIP-0007,kenyanese-the-priest,Kenyaanese is a masked up man with a white cloth as his signature attire. ,335,420,[object Object],[object Object],[object Object],[object Object],[object Object],[object Object],[object Object],[object Object],[object Object]
